{
  "schema_version": "1.0.0",
  "artifact_type": "valuation_peer_universe",
  "artifact_id": "valuation-peer-universe:durable_consumer_goods_tr:1",
  "owner_type": "authored",
  "universe_id": "durable_consumer_goods_tr",
  "universe_version": 1,
  "sector_family": "durable_consumer_goods",
  "method_family_ids": [
    "val.method.earnings_yield.reported_parent",
    "gross_margin",
    "net_margin",
    "free_cash_flow_margin",
    "current_ratio"
  ],
  "effective_from": "2026-01-01",
  "effective_to": null,
  "members": [
    {"member_id": "alcar", "ticker": "ALCAR", "cohort_tier": "primary", "inclusion_rationale_code": "comparison.sector_match", "classification_refs": [], "effective_from": "2026-01-01", "effective_to": null, "applicable_method_family_ids": ["val.method.earnings_yield.reported_parent", "gross_margin", "net_margin", "free_cash_flow_margin", "current_ratio"]},
    {"member_id": "arclk", "ticker": "ARCLK", "cohort_tier": "primary", "inclusion_rationale_code": "comparison.sector_match", "classification_refs": [], "effective_from": "2026-01-01", "effective_to": null, "applicable_method_family_ids": ["val.method.earnings_yield.reported_parent", "gross_margin", "net_margin", "free_cash_flow_margin", "current_ratio"]},
    {"member_id": "silvr", "ticker": "SILVR", "cohort_tier": "primary", "inclusion_rationale_code": "comparison.sector_match", "classification_refs": [], "effective_from": "2026-01-01", "effective_to": null, "applicable_method_family_ids": ["val.method.earnings_yield.reported_parent", "gross_margin", "net_margin", "free_cash_flow_margin", "current_ratio"]},
    {"member_id": "vesbe", "ticker": "VESBE", "cohort_tier": "primary", "inclusion_rationale_code": "comparison.sector_match", "classification_refs": [], "effective_from": "2026-01-01", "effective_to": null, "applicable_method_family_ids": ["val.method.earnings_yield.reported_parent", "gross_margin", "net_margin", "free_cash_flow_margin", "current_ratio"]},
    {"member_id": "vestl", "ticker": "VESTL", "cohort_tier": "primary", "inclusion_rationale_code": "comparison.sector_match", "classification_refs": [], "effective_from": "2026-01-01", "effective_to": null, "applicable_method_family_ids": ["val.method.earnings_yield.reported_parent", "gross_margin", "net_margin", "free_cash_flow_margin", "current_ratio"]},
    {"member_id": "arzum", "ticker": "ARZUM", "cohort_tier": "primary", "inclusion_rationale_code": "comparison.sector_match", "classification_refs": [], "effective_from": "2026-01-01", "effective_to": null, "applicable_method_family_ids": ["val.method.earnings_yield.reported_parent", "gross_margin", "net_margin", "free_cash_flow_margin", "current_ratio"]},
    {"member_id": "iheva", "ticker": "IHEVA", "cohort_tier": "primary", "inclusion_rationale_code": "comparison.sector_match", "classification_refs": [], "effective_from": "2026-01-01", "effective_to": null, "applicable_method_family_ids": ["val.method.earnings_yield.reported_parent", "gross_margin", "net_margin", "free_cash_flow_margin", "current_ratio"]},
    {"member_id": "klmsn", "ticker": "KLMSN", "cohort_tier": "primary", "inclusion_rationale_code": "comparison.sector_match", "classification_refs": [], "effective_from": "2026-01-01", "effective_to": null, "applicable_method_family_ids": ["val.method.earnings_yield.reported_parent", "gross_margin", "net_margin", "free_cash_flow_margin", "current_ratio"]}
  ],
  "inclusion_policy_ref": "val.policy.peer_universe.inclusion@1.0.0",
  "review": {
    "author": "tayfun",
    "reviewer": "tayfun",
    "reviewed_at": "2026-07-31T00:00:00Z",
    "methodology_version": "1.0.0",
    "rationale_codes": ["comparison.sector_match"]
  },
  "lifecycle": "approved",
  "supersedes_ref": null,
  "lineage": {
    "dag": {
      "nodes": [
        {"node_id": "n1", "node_type": "peer_universe", "owner_type": "authored"}
      ],
      "edges": []
    }
  }
}
